sku,name,brand,category,price,url,in_stock,description,manufacturer_part_number,upc,weight,custom_fields,image_url
ZT23143-T21000FZ,"TT Printer ZT231; 4, 300 dpi, Thermal Transfer, Cutter with Catch Tray, US Cord, USB, Serial, Ethernet, BTLE, USB Host, EZPL | ZT23143-T21000FZ",Zebra Technologies,1513,1591.18,https://www.arrowheadphx.com/tt-printer-zt231-4-300-dpi-thermal-transfer-cutter-with-catch-tray-us-cord-usb-serial-ethernet-btle-usb-host-ezpl-zt23143-t21000fz/,True,"TT Printer ZT231; 4, 300 dpi, Thermal Transfer, Cutter with Catch Tray, US Cord, USB, Serial, Ethernet, BTLE, USB Host, EZPL",ZT23143-T21000FZ,,1.0,"{""\""value\"":\""https:\\/\\/www.zebra.com\\/content\\/dam\\/zebra_dam\\/global\\/photography\\/product\\/0001\\/zt231-photography-product-left-media.png?im"": ""p\""}""}",
ZT41142-T01A000Z,"TT Printer ZT411; 4, 203 dpi, US Cord, Serial, USB, 10/100 Ethernet, Bluetooth 4.2/MFi, USB Host, Wireless 802.11 AC Card: US & Canada, EZPL | ZT41142-T01A000Z",Zebra Technologies,1509,1891.96,https://www.arrowheadphx.com/tt-printer-zt411-4-203-dpi-us-cord-serial-usb-10-100-ethernet-bluetooth-4-2-mfi-usb-host-wireless-802-11-ac-card-us-canada-ezpl-zt41142-t01a000z/,True,"TT Printer ZT411; 4, 203 dpi, US Cord, Serial, USB, 10/100 Ethernet, Bluetooth 4.2/MFi, USB Host, Wireless 802.11 AC Card: US & Canada, EZPL",ZT41142-T01A000Z,,2.0,"{""\""value\"":\""https:\\/\\/www.zebra.com\\/content\\/dam\\/zebra_dam\\/global\\/photography\\/product\\/0007\\/zt411-photography-product-headon.tif?im"": ""p\""}""}",
ZT42162-T210000Z,"TT Printer ZT421; 6, 203 dpi, US Cord, Serial, USB, 10/100 Ethernet, Bluetooth 4.1/MFi, USB Host, Cutter w/ Catch Tray, EZPL | ZT42162-T210000Z",Zebra Technologies,1543,3084.77,https://www.arrowheadphx.com/tt-printer-zt421-6-203-dpi-us-cord-serial-usb-10-100-ethernet-bluetooth-4-1-mfi-usb-host-cutter-w-catch-tray-ezpl-zt42162-t210000z/,True,"TT Printer ZT421; 6, 203 dpi, US Cord, Serial, USB, 10/100 Ethernet, Bluetooth 4.1/MFi, USB Host, Cutter w/ Catch Tray, EZPL",ZT42162-T210000Z,,2.0,"{""\""value\"":\""https:\\/\\/www.zebra.com\\/content\\/dam\\/zebra_dam\\/global\\/photography\\/product\\/0008\\/zt421-rfid-photography-product-left.tif?im"": ""p\""}""}",
ZT61042-T010100Z,"TT Printer ZT610; 4, 203 dpi, US Cord, Serial, USB, Gigabit Ethernet, Bluetooth 4.1, USB Host, Tear, Color Touch, ZPL| ZT61042-T010100Z | ZT61042-T010100Z",Zebra Technologies,1536,2466.58,https://www.arrowheadphx.com/zebra-industrial-printer-zt610-4-203-dpi-tt-dt-us-cord-serial-usb-gigabit-ethernet-bluetooth-4-0-usb-host-tear-color-zpl-replaces-xi4-series-and-rxi4-zt61042-t010100z/,True,"TT Printer ZT610; 4, 203 dpi, US Cord, Serial, USB, Gigabit Ethernet, Bluetooth 4.1, USB Host, Tear, Color Touch, ZPL",ZT61042-T010100Z,,2.0,"{""\""value\"":\""https:\\/\\/www.zebra.com\\/content\\/dam\\/zebra_dam\\/global\\/photography\\/product\\/0007\\/zt610-photography-product-headon.tif?im"": ""p\""}""}",
ZT62063-T01A100Z,"TT Printer ZT620; 6, 300 dpi, US Cord, Serial, USB, Gigabit Ethernet, Bluetooth 4.2, USB Host, Wireless 802.11 AC Card:US & Canada, Tear, Color Touch, ZPL| ZT62063-T01A100Z | ZT62063-T01A100Z",Zebra Technologies,1554,4871.88,https://www.arrowheadphx.com/zebra-zt600-series-printers-model-zt620-zt62063-t01a100z/,True,"TT Printer ZT620; 6, 300 dpi, US Cord, Serial, USB, Gigabit Ethernet, Bluetooth 4.2, USB Host, Wireless 802.11 AC Card:US & Canada, Tear, Color Touch, ZPL",ZT62063-T01A100Z,,1.0,"{""\""value\"":\""https:\\/\\/www.zebra.com\\/content\\/dam\\/zebra_dam\\/global\\/photography\\/product\\/0007\\/zt620-photography-product-right.tif?im"": ""p\""}""}",
