sku,name,brand,category,price,url,in_stock,description,manufacturer_part_number,upc,weight,custom_fields,image_url
CS6080-SR40004VZWW,"CS6080 Cordless: Companion Scanner, Inductive, Area Imager, Standard Range, Midnight Black, Vibration Motor | CS6080-SR40004VZWW",Zebra Technologies,1644,345.1,https://www.arrowheadphx.com/cs6080-cordless-companion-scanner-inductive-area-imager-standard-range-midnight-black-vibration-motor-cs6080-sr40004vzww/,True,"CS6080 Cordless: Companion Scanner, Inductive, Area Imager, Standard Range, Midnight Black, Vibration Motor",CS6080-SR40004VZWW,,2.0,"{""\""value\"":\""https:\\/\\/www.zebra.com\\/content\\/dam\\/zebra_dam\\/global\\/photography\\/product\\/0001\\/cs60-photography-product-cordless-corded-combo-no-shadow.tif?im"": ""p\""}""}",
DS2208-SR00007ZZWW,"D22208: Area Imager, Standard Range, Corded, Twilight Black | DS2208-SR00007ZZWW",Zebra Technologies,1537,160.51,https://www.arrowheadphx.com/d22208-area-imager-standard-range-corded-twilight-black-ds2208-sr00007zzww/,True,"D22208: Area Imager, Standard Range, Corded, Twilight Black",DS2208-SR00007ZZWW,,2.0,"{""\""value\"":\""https:\\/\\/www.zebra.com\\/content\\/dam\\/zebra_dam\\/global\\/photography\\/product\\/0001\\/ds2208_engine_up_novawhite.tif?im"": ""p\""}""}",
DS3608-SR00003VZWW,"Rugged, Area Imager, Standard Range, Corded, Industrial Green, Vibration Motor | DS3608-SR00003VZWW",Zebra Technologies,1516,595.07,https://www.arrowheadphx.com/rugged-area-imager-standard-range-corded-industrial-green-vibration-motor-ds3608-sr00003vzww/,True,"Rugged, Area Imager, Standard Range, Corded, Industrial Green, Vibration Motor",DS3608-SR00003VZWW,,2.0,"{""\""value\"":\""https:\\/\\/www.zebra.com\\/content\\/dam\\/zebra_dam\\/global\\/photography\\/product\\/0002\\/ds3600-er-photo-product-cradle-and-non-300.jpg?im"": ""p\""}""}",
DS3678-SR0F003VZWW,"DS3678: Rugged, Area Imager, Standard Range, Cordless, Fips, Industrial Green, Vibration Motor | DS3678-SR0F003VZWW",Zebra Technologies,1516,743.5,https://www.arrowheadphx.com/ds3678-rugged-area-imager-standard-range-cordless-fips-industrial-green-vibration-motor-ds3678-sr0f003vzww/,True,"DS3678: Rugged, Area Imager, Standard Range, Cordless, Fips, Industrial Green, Vibration Motor",DS3678-SR0F003VZWW,,2.0,"{""\""value\"":\""https:\\/\\/www.zebra.com\\/content\\/dam\\/zebra_dam\\/global\\/photography\\/product\\/0002\\/ds3600-er-photo-product-cradle-and-non-300.jpg?im"": ""p\""}""}",
DS4308-SR00007ZZWW,"DS4308 imager,st range,black",Zebra Technologies,,245.7,https://www.arrowheadphx.com/ds4308-imager-st-range-black/,False,"<p>DS4308 Scanner (Imager, Strange, Black)<br /><br />When customers are looking for extraordinary flexibility and performance in a handheld scanner, the next-generation scanning technology in the DS4308-SR/DL/HD delivers.</p>",DS4308-SR00007ZZWW,,0.55,,
DS8108-SR00007ZZWW,"DS8108: Area Imager, Standard Range, Corded, Twilight Black | DS8108-SR00007ZZWW",Zebra Technologies,1548,302.94,https://www.arrowheadphx.com/ds8108-area-imager-standard-range-corded-twilight-black-ds8108-sr00007zzww/,True,"DS8108: Area Imager, Standard Range, Corded, Twilight Black",DS8108-SR00007ZZWW,,2.0,"{""\""value\"":\""https:\\/\\/www.zebra.com\\/content\\/dam\\/zebra_dam\\/global\\/photography\\/product\\/0001\\/ds8178sr_rf_down_twilightblack copy.png?im"": ""p\""}""}",
DS8178-SR0F007ZZWW,"DS8178: Area Imager, Standard Range, Cordless, Twilight Black | DS8178-SR0F007ZZWW",Zebra Technologies,1534,569.14,https://www.arrowheadphx.com/ds8178-area-imager-standard-range-cordless-twilight-black-ds8178-sr0f007zzww/,True,"DS8178: Area Imager, Standard Range, Cordless, Twilight Black",DS8178-SR0F007ZZWW,,2.0,"{""\""value\"":\""https:\\/\\/www.zebra.com\\/content\\/dam\\/zebra_dam\\/global\\/photography\\/product\\/0001\\/ds8178sr_rf_down_twilightblack copy.png?im"": ""p\""}""}",
DS9308-SR00004ZZWW,"DS9308: PRESENTATION AREA IMAGER, STANDARD RANGE, CORDED, MIDNIGHT BLACK | DS9308-SR00004ZZWW",Zebra Technologies,1514,304.34,https://www.arrowheadphx.com/ds9308-presentation-area-imager-standard-range-corded-midnight-black-ds9308-sr00004zzww/,True,"DS9308: PRESENTATION AREA IMAGER, STANDARD RANGE, CORDED, MIDNIGHT BLACK",DS9308-SR00004ZZWW,,2.0,"{""\""value\"":\""https:\\/\\/www.zebra.com\\/content\\/dam\\/zebra_dam\\/global\\/photography\\/product\\/0001\\/ds9308-sr-photography-product-front-facing-shadow-black.tif?im"": ""p\""}""}",
EC300K-1SA2ANA,"EC30 LAN, GMS, SE2100, 4GB/32GB, 1-PACK, US, CANADA & PUERTO RICO| EC300K-1SA2ANA | EC300K-1SA2ANA",Zebra Technologies,2009,488.33,https://www.arrowheadphx.com/ec30-lan-gms-se2100-4gb-32gb-1-pack-us-canada-puerto-rico-ec300k-1sa2ana-ec300k-1sa2ana/,False,"EC30 LAN, GMS, SE2100, 4GB/32GB, 1-PACK, US, CANADA & PUERTO RICO| EC300K-1SA2ANA",EC300K-1SA2ANA,,3.0,,
EC500K-01D121-NA,"EC50 Android, 3Gb Ram/32Gb Flash, No Scan Engine, 5MP Front Camera, 13MP Rear Camera, Micro Sd, Gms, No I/O Connector, Us | EC500K-01D121-NA",Zebra Technologies,1681,1000.17,https://www.arrowheadphx.com/ec50-android-3gb-ram-32gb-flash-no-scan-engine-5mp-front-camera-13mp-rear-camera-micro-sd-gms-no-i-o-connector-us-ec500k-01d121-na/,False,"EC50 Android, 3Gb Ram/32Gb Flash, No Scan Engine, 5MP Front Camera, 13MP Rear Camera, Micro Sd, Gms, No I/O Connector, Us",EC500K-01D121-NA,,2.0,"{""\""value\"":\""https:\\/\\/www.zebra.com\\/content\\/dam\\/zebra_dam\\/global\\/photography\\/product\\/0003\\/ec50-photography-product-front-facing.tif?im"": ""p\""}""}",
EC55AK-21B223-NA,"EC55 Android, 4Gb Ram/64Gb Flash, SE4100, 5MP Front Camera, 13MP Rear Camera, Micro Sd, E-Sim, Gms, 8-Pin Back Connector, Us | EC55AK-21B223-NA",Zebra Technologies,1698,1221.59,https://www.arrowheadphx.com/ec55-android-4gb-ram-64gb-flash-se4100-5mp-front-camera-13mp-rear-camera-micro-sd-e-sim-gms-8-pin-back-connector-us-ec55ak-21b223-na/,False,"EC55 Android, 4Gb Ram/64Gb Flash, SE4100,  5MP Front Camera, 13MP Rear Camera, Micro Sd, E-Sim, Gms, 8-Pin Back Connector, Us",EC55AK-21B223-NA,,2.0,"{""\""value\"":\""https:\\/\\/www.zebra.com\\/content\\/dam\\/zebra_dam\\/global\\/photography\\/product\\/0003\\/ec50-ec55-photography-product-back-facing-2-pin-extended-battery.tif?im"": ""p\""}""}",
FX7500-22320A56-US,"FX7500 Fixed RFID Reader, 2-Port, No Host USB Port, US",Zebra Technologies,2120,1120.79,https://www.arrowheadphx.com/FX7500-22320A56-US/,False,"FX7500 Fixed RFID Reader, 2-Port, No Host USB Port, US",FX7500-22320A56-US,,6.0,,
FX9600-82325A56-WR,"FX9600 Fixed RFID Reader, 8-Port, No Host USB Port, Worldwide",Zebra Technologies,2118,1650.76,https://www.arrowheadphx.com/FX9600-82325A56-WR/,False,"FX9600 Fixed RFID Reader, 8-Port, No Host USB Port, Worldwide",FX9600-82325A56-WR,,6.0,,
LI3608-SR00003VZWW,"LI3608: RUGGED, LINEAR IMAGER, STANDARD RANGE, CORDED, INDUSTRIAL GREEN | LI3608-SR00003VZWW",Zebra Technologies,1680,469.54,https://www.arrowheadphx.com/li3608-rugged-linear-imager-standard-range-corded-industrial-green-li3608-sr00003vzww/,True,"LI3608: RUGGED, LINEAR IMAGER, STANDARD RANGE, CORDED, INDUSTRIAL GREEN| LI3608-SR00003VZWW",LI3608-SR00003VZWW,,3.0,,
LI3678-SR0F003VZWW,"Li3678: Rugged, Linear Imager, Standard Range, Cordless, Fips, Industrial Green, Vibration Motor | LI3678-SR0F003VZWW",Zebra Technologies,1680,599.39,https://www.arrowheadphx.com/li3678-rugged-linear-imager-standard-range-cordless-fips-industrial-green-vibration-motor-li3678-sr0f003vzww/,True,"Li3678: Rugged, Linear Imager, Standard Range, Cordless, Fips, Industrial Green, Vibration Motor| LI3678-SR0F003VZWW",LI3678-SR0F003VZWW,,3.0,,
RFD4030-G00B700-US,"RFD40, Standard, Standard Range Circular Polarized Antenna, UHF RFID Only, Gun, No Imager, 7000mAh Battery, Midnight Black, US, Canada, & Puerto Rico Only, TAA Compliant | RFD4030-G00B700-US",Zebra Technologies,2119,1024.41,https://www.arrowheadphx.com/rfd40-standard-standard-range-circular-polarized-antenna-uhf-rfid-only-gun-no-imager-7000mah-battery-midnight-black-us-canada-puerto-rico-only-taa-compliant-rfd4030-g00b700-us/,True,"RFD40, Standard, Standard Range Circular Polarized Antenna, UHF RFID Only, Gun, No Imager, 7000mAh Battery, Midnight Black, US, Canada, & Puerto Rico Only, TAA Compliant",RFD4030-G00B700-US,,2.0,"{""\""value\"":\""https:\\/\\/www.zebra.com\\/content\\/dam\\/zebra_dam\\/global\\/photography\\/product\\/0009\\/rfid40-standard-standalone-photography-product-front-right-side-with-shadow.tif?im"": ""p\""}""}",
RFD8500-5000100-US,"UHF Bluetooth RFID Sled Reader: Gun FF, SE4710 Imager, 4410mAh 3.7Vdc, US freq band| RFD8500-5000100-US | RFD8500-5000100-US",Zebra Technologies,,1725.43,https://www.arrowheadphx.com/rfd8500-rfid-sled-with-imager-rfd8500-5000100-us/,False,"UHF Bluetooth RFID Sled Reader: Gun FF, SE4710 Imager, 4410mAh 3.7Vdc, US freq band| RFD8500-5000100-US",RFD8500-5000100-US,,3.0,"{""\""value\"":\""<img src"": ""\\/product_images\\/map2.png alt=MAP POLICY>\""}""}",
RFD9031-G30G700-US,"RFD90, Premium Plus, Standard Range Circular Polarized Antenna, UHF RFID, Bluetooth, WiFi, Gun, SE4750MR Imager, 7000mAh Battery, Midnight Black/Industrial Green, US, Canada, & Puerto Rico Only, TAA Compliant | RFD9031-G30G700-US",Zebra Technologies,2381,1639.55,https://www.arrowheadphx.com/rfd90-premium-plus-standard-range-circular-polarized-antenna-uhf-rfid-bluetooth-wifi-gun-se4750mr-imager-7000mah-battery-midnight-black-industrial-green-us-canada-puerto-rico-only-taa-compliant-rfd9031-g30g700-us/,True,"RFD90, Premium Plus, Standard Range Circular Polarized Antenna, UHF RFID, Bluetooth, WiFi, Gun, SE4750MR Imager, 7000mAh Battery, Midnight Black/Industrial Green, US, Canada, & Puerto Rico Only, TAA Compliant",RFD9031-G30G700-US,,2.0,,
TC210K-01A222-NA,"WLAN, SE4710, 13MP RFC, 3GB/32GB, 2-PIN I/O CONNECTOR, 5MP FFC, NFC, Basic Battery, GMS, NA | TC210K-01A222-NA",Zebra Technologies,1591,730.29,https://www.arrowheadphx.com/wlan-se4710-13mp-rfc-3gb-32gb-2-pin-i-o-connector-5mp-ffc-nfc-basic-battery-gms-na-tc210k-01a222-na/,False,"WLAN, SE4710, 13MP RFC, 3GB/32GB,  2-PIN I/O CONNECTOR, 5MP FFC, NFC, Basic  Battery, GMS, NA",TC210K-01A222-NA,,2.0,"{""\""value\"":\""https:\\/\\/www.zebra.com\\/content\\/dam\\/zebra_dam\\/global\\/photography\\/product\\/0004\\/tc21-photography-product-right-facing.tif?im"": ""p\""}""}",
WLMT0-T22B6ABC2-NA,"TC22; WLAN, Wifi 6, SE4710, 6 Display, 6GB/64GB, 16MP RFC, 5MP FFC, 2-Pin Back I/O, Standard Battery, NFC, BT, USB-C, GMS, NA | WLMT0-T22B6ABC2-NA",Zebra Technologies,1578,1016.05,https://www.arrowheadphx.com/tc22-wlan-wifi-6-se4710-6-display-6gb-64gb-16mp-rfc-5mp-ffc-2-pin-back-i-o-standard-battery-nfc-bt-usb-c-gms-na-wlmt0-t22b6abc2-na/,True,"TC22; WLAN, Wifi 6, SE4710, 6 Display, 6GB/64GB, 16MP RFC, 5MP FFC, 2-Pin Back I/O, Standard Battery, NFC, BT, USB-C, GMS, NA| WLMT0-T22B6ABC2-NA",WLMT0-T22B6ABC2-NA,,3.0,"{""\""value\"":\""https:\\/\\/www.zebra.com\\/content\\/dam\\/zebra_dam\\/global\\/photography\\/product\\/0016\\/tc22-tc27-eight-pin-beauty-product-front-left-facing-up-no-shadow.tif?im"": ""p\""}""}",
TC26AK-11A222-NA,"WWAN - Single WAN, GMS, SE4710, NFC, 3GB/32GB, 13 MP RFC, 5MP FFC, 2-pin connector, Basic Battery, NA | TC26AK-11A222-NA",Zebra Technologies,1583,777.47,https://www.arrowheadphx.com/wwan-single-wan-gms-se4710-nfc-3gb-32gb-13-mp-rfc-5mp-ffc-2-pin-connector-basic-battery-na-tc26ak-11a222-na/,False,"WWAN - Single WAN, GMS, SE4710,  NFC, 3GB/32GB, 13 MP RFC, 5MP FFC, 2-pin connector, Basic Battery, NA",TC26AK-11A222-NA,,2.0,"{""\""value\"":\""https:\\/\\/www.zebra.com\\/content\\/dam\\/zebra_dam\\/global\\/photography\\/product\\/0014\\/tc26-photography-product-front-facing.png?im"": ""p\""}""}",
WCMTA-T27B6ABC2-NA,"TC27; WWAN, 5G, Wifi 6, SE4710, 6 Display, 6GB/64GB, 16MP RFC, 5MP FFC, 2-Pin Back I/O, Standard Battery, NFC, BT, USB-C, SIM & ESIM, GMS, NA| WCMTA-T27B6ABC2-NA | WCMTA-T27B6ABC2-NA",Zebra Technologies,1586,1053.2,https://www.arrowheadphx.com/tc27-wwan-5g-wifi-6-se4710-6-display-6gb-64gb-16mp-rfc-5mp-ffc-2-pin-back-i-o-standard-battery-nfc-bt-usb-c-sim-esim-gms-na-wcmta-t27b6abc2-na-wcmta-t27b6abc2-na/,True,"TC27; WWAN, 5G, Wifi 6, SE4710, 6 Display, 6GB/64GB, 16MP RFC, 5MP FFC, 2-Pin Back I/O, Standard Battery, NFC, BT, USB-C, SIM & ESIM, GMS, NA| WCMTA-T27B6ABC2-NA",WCMTA-T27B6ABC2-NA,,3.0,,
TC520L-1YLMU7P-NA,"TC52ax, NA, Wi-Fi 6, SE5500 Imager, 4/64GB , PowerPrecision Plus+, Battery, 4150 mAh | TC520L-1YLMU7P-NA",Zebra Technologies,1599,1821.16,https://www.arrowheadphx.com/tc52ax-na-wi-fi-6-se5500-imager-4-64gb-powerprecision-plus-battery-4150-mah-tc520l-1ylmu7p-na/,True,"TC52ax, NA, Wi-Fi 6, SE5500 Imager, 4/64GB , PowerPrecision Plus+, Battery, 4150 mAh",TC520L-1YLMU7P-NA,,2.0,"{""\""value\"":\""https:\\/\\/www.zebra.com\\/content\\/dam\\/zebra_dam\\/global\\/photography\\/product\\/0004\\/tc52ax-se4720-photography-product-top-front-left-facing.tif?im"": ""p\""}""}",
TC5301-0T1E4B1000-NA,"TC53, LAN, 6.0 Display, WiFi 6E, 4GB RAM/64GB ROM, SE4720 Imager, 3.5MM Headphone Jack, 8MP FFC, 16MP RFC, Warm Swap, 4400 mAh Standard Battery, GMS, NA only | TC5301-0T1E4B1000-NA",Zebra Technologies,1582,1947.46,https://www.arrowheadphx.com/tc53-lan-6-0-display-wifi-6e-4gb-ram-64gb-rom-se4720-imager-3-5mm-headphone-jack-8mp-ffc-16mp-rfc-warm-swap-4400-mah-standard-battery-gms-na-only-tc5301-0t1e4b1000-na/,True,"TC53, LAN, 6.0 Display, WiFi 6E, 4GB RAM/64GB ROM, SE4720 Imager, 3.5MM Headphone Jack, 8MP FFC, 16MP RFC, Warm Swap, 4400 mAh Standard Battery, GMS, NA only",TC5301-0T1E4B1000-NA,,2.0,"{""\""value\"":\""https:\\/\\/www.zebra.com\\/content\\/dam\\/zebra_dam\\/global\\/photography\\/product\\/0012\\/tc53-photography-product-front facing.png?im"": ""p\""}""}",
TC57HO-1XFMU6P-NA,"TC57X Wan Lte For Na, 5Fhd Display, Octa-Core Processor, SE4720 Imager, Nfc, 2 Pin+C4:C6 Rear Electrical Io, 7 Pin Bottom Connector, 4/32 Gb Ufs Ram/Flash, Gms | TC57HO-1XFMU6P-NA",Zebra Technologies,1642,1655.69,https://www.arrowheadphx.com/tc57x-wan-lte-for-na-5fhd-display-octa-core-processor-se4720-imager-nfc-2-pin-c4-c6-rear-electrical-io-7-pin-bottom-connector-4-32-gb-ufs-ram-flash-gms-tc57ho-1xfmu6p-na/,True,"TC57X Wan Lte For Na,  5Fhd Display, Octa-Core Processor, SE4720 Imager, Nfc, 2 Pin+C4:C6 Rear Electrical Io, 7 Pin Bottom Connector, 4/32 Gb Ufs Ram/Flash, Gms",TC57HO-1XFMU6P-NA,,2.0,"{""\""value\"":\""https:\\/\\/www.zebra.com\\/content\\/dam\\/zebra_dam\\/global\\/photography\\/product\\/0014\\/tc57x-front-facing.png?im"": ""p\""}""}",
TC58A1-3T1E4B1010-NA,"TC58, WAN, 6.0 Display, 5G FR1, CBRS, WiFi 6E, 4GB RAM/64GB ROM, SE4720 Imager, 8MP FFC, 16MP RFC, Warm Swap, 4400 mAh Standard Battery, GMS, NA ONLY | TC58A1-3T1E4B1010-NA",Zebra Technologies,1608,2061.07,https://www.arrowheadphx.com/tc58-wan-6-0-display-5g-fr1-cbrs-wifi-6e-4gb-ram-64gb-rom-se4720-imager-8mp-ffc-16mp-rfc-warm-swap-4400-mah-standard-battery-gms-na-only-tc58a1-3t1e4b1010-na/,True,"TC58, WAN, 6.0 Display, 5G FR1, CBRS, WiFi 6E, 4GB RAM/64GB ROM, SE4720 Imager, 8MP FFC, 16MP RFC, Warm Swap, 4400 mAh Standard Battery, GMS, NA ONLY",TC58A1-3T1E4B1010-NA,,2.0,"{""\""value\"":\""https:\\/\\/www.zebra.com\\/content\\/dam\\/zebra_dam\\/global\\/photography\\/product\\/0012\\/tc58-photography-product-front-facing.tif?im"": ""p\""}""}",
TC720L-0ME24B0-FT,"TC72 ANDROID, 4GB RAM/32GB FLASH, SE4750 SR, 5MP FRONT, 13MP REAR CAMERA, MICRO SD, GMS, FIPS/TAA Compliant | TC720L-0ME24B0-FT",Zebra Technologies,1606,2343.26,https://www.arrowheadphx.com/tc72-android-4gb-ram-32gb-flash-se4750-sr-5mp-front-13mp-rear-camera-micro-sd-gms-fips-taa-compliant-tc720l-0me24b0-ft/,True,"TC72 ANDROID, 4GB RAM/32GB FLASH, SE4750 SR, 5MP FRONT, 13MP REAR CAMERA, MICRO SD, GMS, FIPS/TAA Compliant",TC720L-0ME24B0-FT,,2.0,"{""\""value\"":\""https:\\/\\/www.zebra.com\\/content\\/dam\\/zebra_dam\\/global\\/photography\\/product\\/0004\\/tc72-photography-product-left.tif?im"": ""p\""}""}",
TC7301-0T1J4B1000-NA,"TC73, LAN, 6.0, Wifi 6E, 4GB RAM/64GB flash, SE4770, 8MP front camera, 16MP rear camera, warm swap, standard battery, GMS, NA | TC7301-0T1J4B1000-NA",Zebra Technologies,1592,2457.13,https://www.arrowheadphx.com/tc73-lan-6-0-wifi-6e-4gb-ram-64gb-flash-se4770-8mp-front-camera-16mp-rear-camera-warm-swap-standard-battery-gms-na-tc7301-0t1j4b1000-na/,True,"TC73, LAN, 6.0, Wifi 6E, 4GB RAM/64GB flash, SE4770, 8MP front camera, 16MP rear camera, warm swap, standard battery, GMS, NA",TC7301-0T1J4B1000-NA,,2.0,"{""\""value\"":\""https:\\/\\/www.zebra.com\\/content\\/dam\\/zebra_dam\\/global\\/photography\\/product\\/0014\\/tc73-se55-photography-product-top-front-right-facing-no-headset-jack.tif?im"": ""p\""}""}",
TC77HL-5ME24BG-NA,"TC77 SE4750, 5MP F/13MP R CAMERA, ANDROID, 4GB RAM/32GB FLASH, 2 SIM/, 1 MICRO SD, GMS, USA/CANADA/PUERTO RICO ONLY | TC77HL-5ME24BG-NA",Zebra Technologies,1624,2622.48,https://www.arrowheadphx.com/tc77-se4750-5mp-f-13mp-r-camera-android-4gb-ram-32gb-flash-2-sim-1-micro-sd-gms-usa-canada-puerto-rico-only-tc77hl-5me24bg-na/,False,"TC77 SE4750, 5MP F/13MP R CAMERA, ANDROID, 4GB RAM/32GB FLASH, 2 SIM/, 1 MICRO SD, GMS, USA/CANADA/PUERTO RICO ONLY",TC77HL-5ME24BG-NA,,2.0,"{""\""value\"":\""https:\\/\\/www.zebra.com\\/content\\/dam\\/zebra_dam\\/global\\/photography\\/product\\/0004\\/tc77-photography-product-right.tif?im"": ""p\""}""}",
TC78A1-3T1J4B1A10-NA,"TC78, WAN, 6.0, sub-6 5G, Wifi 6E, CBRS, 4GB RAM/64GB flash, SE4770, 8MP front camera, 16MP rear camera, warm swap, wireless charging enabled, standard battery, GMS, NA | TC78A1-3T1J4B1A10-NA",Zebra Technologies,1635,2714.08,https://www.arrowheadphx.com/tc78-wan-6-0-sub-6-5g-wifi-6e-cbrs-4gb-ram-64gb-flash-se4770-8mp-front-camera-16mp-rear-camera-warm-swap-wireless-charging-enabled-standard-battery-gms-na-tc78a1-3t1j4b1a10-na/,True,"TC78, WAN, 6.0, sub-6 5G, Wifi 6E, CBRS, 4GB RAM/64GB flash, SE4770, 8MP front camera, 16MP rear camera, warm swap, wireless charging enabled, standard battery, GMS, NA",TC78A1-3T1J4B1A10-NA,,2.0,"{""\""value\"":\""https:\\/\\/www.zebra.com\\/content\\/dam\\/zebra_dam\\/global\\/photography\\/product\\/0014\\/tc78-photography-product-front-right-facing.tif?im"": ""p\""}""}",
TC80NH-2101K42ENA,"TC8000, EXPANSION, 802.11 A/B/G/N, BT 4.0, NFC, 2D IMAGER MEDIUM RANGE (SE4750MR), 8 MP CAMERA, 4 WVGA DISPLAY, 1 GB RAM, 8 GB FLASH, ANDROID LOLLIPOP 5.1.X, PROXIMITY SENSOR, ACCELEROMETER, GYROSCOPE, DIGITAL COMPASS, NORTH AMERICA | TC80NH-2101K42",Zebra Technologies,1688,4526.53,https://www.arrowheadphx.com/tc8000-expansion-802-11-a-b-g-n-bt-4-0-nfc-2d-imager-medium-range-se4750mr-8-mp-camera-4-wvga-display-1-gb-ram-8-gb-flash-android-lollipop-5-1-x-proximity-sensor-accelerometer-gyroscope-digital-compass-north-america-tc80nh-2101k42/,False,"TC8000, EXPANSION, 802.11 A/B/G/N, BT 4.0, NFC, 2D IMAGER MEDIUM RANGE (SE4750MR), 8 MP CAMERA, 4 WVGA DISPLAY, 1 GB RAM, 8 GB FLASH, ANDROID LOLLIPOP 5.1.X, PROXIMITY SENSOR, ACCELEROMETER, GYROSCOPE, DIGITAL COMPASS, NORTH AMERICA",TC80NH-2101K42ENA,,1.0,,
TC83B0-3005A510NA,"TC8300, BASE, 2D IMAGER EXTENDED RANGE (SE4850), 4 GB RAM, 32 GB FLASH, ALL-TOUCH TE, NORTH AMERICA (US, CA, PR) | TC83B0-3005A510NA",Zebra Technologies,1688,2840.33,https://www.arrowheadphx.com/tc8300-base-2d-imager-extended-range-se4850-4-gb-ram-32-gb-flash-all-touch-te-north-america-us-ca-pr-tc83b0-3005a510na/,True,"TC8300, BASE, 2D IMAGER EXTENDED RANGE (SE4850), 4 GB RAM, 32 GB FLASH, ALL-TOUCH TE, NORTH AMERICA (US, CA, PR)",TC83B0-3005A510NA,,2.0,"{""\""value\"":\""https:\\/\\/www.zebra.com\\/content\\/dam\\/zebra_dam\\/global\\/photography\\/product\\/0004\\/tc8300-photography-product-front-right.tif?im"": ""p\""}""}",
ZD4A022-D01E00EZ,"Direct Thermal Printer ZD411; 203 dpi, USB, USB Host, Ethernet, BTLE5, US Cord, Swiss Font, EZPL | ZD4A022-D01E00EZ",Zebra Technologies,1544,407.45,https://www.arrowheadphx.com/direct-thermal-printer-zd411-203-dpi-usb-usb-host-ethernet-btle5-us-cord-swiss-font-ezpl-zd4a022-d01e00ez/,True,"Direct Thermal Printer ZD411; 203 dpi, USB, USB Host, Ethernet, BTLE5, US Cord, Swiss Font, EZPL",ZD4A022-D01E00EZ,,2.0,,
ZD42042-D01E00EZ,ZD420 DT 203DPI US CORD USB BTLE | ZD42042-D01E00EZ,Zebra Technologies,1184,528.55,https://www.arrowheadphx.com/zd420-dt-203dpi-us-cord-usb-btle-zd42042-d01e00ez/,True,"<h1><span data-sheets-value=""{&quot;1&quot;:2,&quot;2&quot;:&quot;ZD42042-D01E00EZ&quot;}"" data-sheets-userformat=""{&quot;2&quot;:16897,&quot;3&quot;:{&quot;1&quot;:0},&quot;12&quot;:0,&quot;17&quot;:1}"">ZD42042-D01E00EZ -&nbsp;<span data-sheets-value=""{&quot;1&quot;:2,&quot;2&quot;:&quot;ZD420 DT 203DPI US CORD USB BTLE&quot;}"" data-sheets-userformat=""{&quot;2&quot;:16897,&quot;3&quot;:{&quot;1&quot;:0},&quot;12&quot;:0,&quot;17&quot;:1}"">ZD420 DT 203DPI US CORD USB BTLE</span></span></h1> <div id=""side-bar-box"" class=""sidebar-box mh-100"" data-bind=""css:{'mh-100': !showLess()}""> <div class=""mb-10 font-weight-bold""><span>Model Name:&nbsp;</span><span data-bind=""text:product().x_productFriendlyName"">ZD420d Advanced Desktop 4-inch Wide Standard</span></div> <p data-bind=""html: product().description"">DT Printer ZD420; Standard EZPL, 203 dpi, US Cord, USB, USB Host, BTLE, Modular Connectivity Slot - Ethernet</p> <div class=""mt-20"" data-bind=""html: product().x_bulletedLongDescription""> <ul> <li>New at-a-glance five LED icons take the guesswork out of printer status. A three-button user interface with five LED status icons replaces the typical single button/single light interface common in desktop printers.</li> <li>Multiple connectivity options</li> <li>Optional battery for cordless operation</li> <li>Sharp 300 dpi printing option</li> <li>Print DNA&rsquo;s innovative applications, utilities and developer tools deliver a superior printing experience through better performance, simplified remote manageability and easier integration.</li> </ul> </div> </div>",ZD42042-D01E00EZ,,7.0,,
ZD4A042-301M00EZ,"Thermal Transfer Printer (74/300M) ZD421; 203 dpi, USB, USB Host, Modular Connectivity Slot, BTLE5, US Cord, Swiss Font, EZPL | ZD4A042-301M00EZ",Zebra Technologies,1518,545.23,https://www.arrowheadphx.com/zd421-thermal-transfer-4-print-width-advanced-desktop-printer-zd4a042-301m00ez/,True,"Thermal Transfer Printer (74/300M) ZD421; 203 dpi, USB, USB Host, Modular Connectivity Slot, BTLE5, US Cord, Swiss Font, EZPL",ZD4A042-301M00EZ,,2.0,,
ZD6A022-D01B01EZ,"Direct Thermal Printer ZD611; 203 dpi, USB, USB Host, Ethernet, 802.11ac, BT4, USA/Canada, US Cord, Swiss Font, EZPL | ZD6A022-D01B01EZ",Zebra Technologies,1947,556.72,https://www.arrowheadphx.com/direct-thermal-printer-zd611-203-dpi-usb-usb-host-ethernet-802-11ac-bt4-usa-canada-us-cord-swiss-font-ezpl-zd6a022-d01b01ez/,True,"Direct Thermal Printer ZD611; 203 dpi, USB, USB Host, Ethernet, 802.11ac, BT4, USA/Canada, US Cord, Swiss Font, EZPL",ZD6A022-D01B01EZ,,1.0,,
ZD6A042-301F00EZ,"Thermal Transfer Printer (74/300M) ZD621; 203 dpi, USB, USB Host, Ethernet, Serial, BTLE5, US Cord, Swiss Font, EZPL | ZD6A042-301F00EZ",Zebra Technologies,1540,695.35,https://www.arrowheadphx.com/zd621-thermal-transfer-4-print-width-premium-desktop-printer-zd6a042-301f00ez/,True,"Thermal Transfer Printer (74/300M) ZD621; 203 dpi, USB, USB Host, Ethernet, Serial, BTLE5, US Cord, Swiss Font, EZPL",ZD6A042-301F00EZ,,2.0,,
ZE51142-L010000Z,"TT Printer ZE511; 4, 203 dpi, LH, US Cord, USB, Serial, Ethernet, Bluetooth 4.1, Dual USB Host, Color Touch, ZPL | ZE51142-L010000Z",Zebra Technologies,1662,4166.0,https://www.arrowheadphx.com/zebra-ze511-lh-print-engine-203dpi/,True,"TT Printer ZE511; 4, 203 dpi, LH, US Cord, USB, Serial, Ethernet, Bluetooth 4.1, Dual USB Host, Color Touch, ZPL",ZE51142-L010000Z,,2.0,"{""\""value\"":\""https:\\/\\/www.zebra.com\\/content\\/dam\\/zebra_dam\\/global\\/photography\\/product\\/0008\\/ze511-photography-product-left.tif?im"": ""p\""}""}",
ZQ61-HUWA004-00,"DT Printer ZQ610 Plus 2/48mm Healthcare; English/Latin fonts,Dual 802.11AC / BT4.x, Linered platen, 0.75 core, Group 0, Belt clip | ZQ61-HUWA004-00",Zebra Technologies,1600,995.2,https://www.arrowheadphx.com/dt-printer-zq610-plus-2-48mm-healthcare-english-latin-fonts-dual-802-11ac-bt4-x-linered-platen-0-75-core-group-0-belt-clip-zq61-huwa004-00/,True,"DT Printer ZQ610 Plus 2/48mm Healthcare; English/Latin fonts,Dual 802.11AC / BT4.x, Linered platen, 0.75 core, Group 0, Belt clip",ZQ61-HUWA004-00,,2.0,"{""\""value\"":\""https:\\/\\/www.zebra.com\\/content\\/dam\\/zebra_dam\\/global\\/photography\\/product\\/0014\\/zq610hc-plus-photography-product-left.tif?im"": ""p\""}""}",
ZQ63-RUWA004-00,"DT Printer ZQ630 Plus RFID; English fonts,Dual 802.11AC / BT4.x, Linered platen, 0.75 core, Group 0, Belt clip | ZQ63-RUWA004-00",Zebra Technologies,1573;2318;2379,1744.28,https://www.arrowheadphx.com/dt-printer-zq630-plus-rfid-english-fonts-dual-802-11ac-bt4-x-linered-platen-0-75-core-group-0-belt-clip-zq63-ruwa004-00/,True,"DT Printer ZQ630 Plus RFID; English fonts,Dual 802.11AC / BT4.x, Linered platen, 0.75 core, Group 0, Belt clip| ZQ63-RUWA004-00",ZQ63-RUWA004-00,,3.0,"{""\""value\"":\""https:\\/\\/www.zebra.com\\/content\\/dam\\/zebra_dam\\/global\\/photography\\/product\\/0014\\/zq630-plus-rfid-photography-product-left.tif?im"": ""p\""}""}",
ZT11143-T01000FZ,"TT Printer ZT111; 4, 300 dpi, Thermal Transfer, Tear, US Cord, USB, Serial, Ethernet, BTLE, USB Host, EZPL | ZT11143-T01000FZ",Zebra Technologies,1541,1134.68,https://www.arrowheadphx.com/tt-printer-zt111-4-300-dpi-thermal-transfer-tear-us-cord-usb-serial-ethernet-btle-usb-host-ezpl-zt11143-t01000fz/,True,"TT Printer ZT111; 4, 300 dpi, Thermal Transfer, Tear, US Cord, USB, Serial, Ethernet, BTLE, USB Host, EZPL",ZT11143-T01000FZ,,2.0,"{""\""value\"":\""https:\\/\\/www.zebra.com\\/content\\/dam\\/zebra_dam\\/global\\/photography\\/product\\/0001\\/zt111-photography-product-left-media.png?im"": ""p\""}""}",
